<?xml version="1.0" encoding="UTF-8"?>
<po:potvrda-vakcinacije xmlns:tp="http://www.rokzasok.rs/tipovi"
                        xmlns="http://www.w3.org/ns/rdfa#"
                        xmlns:pred="http://www.rokzasok.rs/rdf/database/predicate/"
                        xmlns:po="http://www.rokzasok.rs/zdravstveni-radnik/potvrda-vakcinacije"
                        xmlns:xsi="http://www.w3.org/2001/XMLSchema-instance"
                        xsi:schemaLocation="http://www.rokzasok.rs/zdravstveni-radnik/potvrda-vakcinacije schema/potvrda_vakcinacije.xsd"
                        about="http://www.rokzasok.rs/rdf/database/potvrda-vakcinacije/1" rel="pred:kreiranOdStrane"
                        xmlns:xs="http://www.w3.org/2001/XMLSchema#"
                        href="http://www.rokzasok.rs/rdf/database/osoba/1234567890123"
                        vocab="http://www.rokzasok.rs/rdf/database/predicate">
    <po:osoba vocab="http://www.rokzasok.rs/rdf/database/predicate"
              about="http://www.rokzasok.rs/rdf/database/osoba/1234567890123" idOsobe="1234">
        <po:jmbg>1234567890123</po:jmbg>
        <po:ime>Zdravko</po:ime>
        <po:prezime>Krivokapic</po:prezime>
        <po:pol>M</po:pol>
        <po:datum_rodjenja>1976-10-26</po:datum_rodjenja>
    </po:osoba>
    <po:doze>
        <po:doza about="http://www.rokzasok.rs/rdf/database/doza/1"
                 vocab="http://www.rokzasok.rs/rdf/database/predicate">
            <po:tip>Pfizer-BioNtech</po:tip>
            <po:proizvodjac>BioNTech Manufacturing GMBH</po:proizvodjac>
            <po:datum>2020-08-19+02:00</po:datum>
            <po:broj_serije>broj_serije1</po:broj_serije>
            <po:broj_doze>1</po:broj_doze>
            <po:ustanova>
                <po:naziv>Dom Zdravlja</po:naziv>
                <po:mesto>Uzice</po:mesto>
            </po:ustanova>
        </po:doza>
        <po:doza about="http://www.rokzasok.rs/rdf/database/doza/2"
                 vocab="http://www.rokzasok.rs/rdf/database/predicate">
            <po:tip>Pfizer-BioNtech</po:tip>
            <po:proizvodjac>BioNTech Manufacturing GMBH</po:proizvodjac>
            <po:datum>2006-05-04</po:datum>
            <po:broj_serije>broj_serije1</po:broj_serije>
            <po:broj_doze>2</po:broj_doze>
            <po:ustanova>
                <po:naziv>Sajam</po:naziv>
                <po:mesto>Novi Sad</po:mesto>
            </po:ustanova>
        </po:doza>
    </po:doze>
    <po:razlog_izdavanja datatype="xs:string" property="pred:razlogIzdavanja">razlog_izdavanja0</po:razlog_izdavanja>
    <po:datum_izdavanja datatype="xs:date" property="pred:datumIzdavanja">2006-05-04</po:datum_izdavanja>
    <po:dokument_id>1</po:dokument_id>
</po:potvrda-vakcinacije>
