<?xml version="1.0" encoding="UTF-8"?>
<po:potvrda-vakcinacije xmlns:tp="http://www.rokzasok.rs/tipovi"
 xmlns:r="http://www.w3.org/ns/rdfa#"
 xmlns:pred="http://www.rokzasok.rs/rdf/database/predicate/"
 xmlns:po="http://www.rokzasok.rs/zdravstveni-radnik/potvrda-vakcinacije"
 xmlns:xsi="http://www.w3.org/2001/XMLSchema-instance"
 xsi:schemaLocation="http://www.rokzasok.rs/zdravstveni-radnik/potvrda-vakcinacije potvrda_vakcinacije.xsd">
    <po:osoba>
        <po:jmbg>1234567891011</po:jmbg>
        <po:ime>Marko</po:ime>
        <po:prezime>Marković</po:prezime>
        <po:pol>M</po:pol>
        <po:datum_rodjenja>1952-10-07</po:datum_rodjenja>
        <po:id>1</po:id>
    </po:osoba>
    <po:doze>
        <po:doza>
            <po:tip>Sputnik V (Gamaleya istraživački centar)</po:tip>
            <po:proizvodjac>Gamaleya Institute</po:proizvodjac>
            <po:datum>2022-02-26</po:datum>
            <po:broj_serije>GAMALEYA01</po:broj_serije>
            <po:broj_doze>1</po:broj_doze>
            <po:ustanova>
                <po:naziv>Dom zdravlja</po:naziv>
                <po:mesto>Novi Sad</po:mesto>
            </po:ustanova>
        </po:doza>
        <po:doza>
            <po:tip>Sputnik V (Gamaleya istraživački centar)</po:tip>
            <po:proizvodjac>Gamaleya Institute</po:proizvodjac>
            <po:datum>2022-02-27</po:datum>
            <po:broj_serije>GAMALEYA02</po:broj_serije>
            <po:broj_doze>2</po:broj_doze>
            <po:ustanova>
                <po:naziv>Dom zdravlja</po:naziv>
                <po:mesto>Novi Sad</po:mesto>
            </po:ustanova>
        </po:doza>
    </po:doze>
    <po:qr_link>potvrda.com</po:qr_link>
    <po:datum_izdavanja>2022-02-27</po:datum_izdavanja>
    <po:dokument_id>1</po:dokument_id>
</po:potvrda-vakcinacije>
